answerKey,id,A,B,C,D,stem,Grade,subject,category
A,MEA_2011_5_3,{img:images/StatesDMC-DA/MEA/5thGr/MEA-5-2011-1.png},{img:images/StatesDMC-DA/MEA/5thGr/MEA-5-2011-2.png},{img:images/StatesDMC-DA/MEA/5thGr/MEA-5-2011-3.png},{img:images/StatesDMC-DA/MEA/5thGr/MEA-5-2011-4.png},Which organism is made of one cell?,5,,Test
D,MEA_2011_5_4,in the ground,in the trees,in the desert,in the ocean,The picture below shows a fossil of an animal {img:images/StatesDMC-DA/MEA/5thGr/MEA-5-2011-5.png} Where did this animal live?,5,,Test
B,MEA_2011_5_7,bacteria,grass,mouse,fox,The diagram below shows a food chain. {img:images/StatesDMC-DA/MEA/5thGr/MEA-5-2011-6.png} Which organism is the best choice for W in the food chain?,5,,Test
C,MEAP_2005_5_13,{img:images/StatesDMC-DA/MEAP/5thGr/MEAP-5-2005-5.png},{img:images/StatesDMC-DA/MEAP/5thGr/MEAP-5-2005-6.png},{img:images/StatesDMC-DA/MEAP/5thGr/MEAP-5-2005-7.png},{img:images/StatesDMC-DA/MEAP/5thGr/MEAP-5-2005-8.png},Which of the following is a correct parent-offspring pair?,5,,Test
C,MEAP_2005_5_2,the ruler and the compass,the pinwheel and the ruler,the compass and the pinwheel,the thermometer and the compass,{img:images/StatesDMC-DA/MEAP/5thGr/MEAP-5-2005-1.png} Which two items shown above can be used together to determine the direction of the wind?,5,,Test
B,MEAP_2005_5_25,{img:images/StatesDMC-DA/MEAP/5thGr/MEAP-5-2005-12.png},{img:images/StatesDMC-DA/MEAP/5thGr/MEAP-5-2005-13.png},{img:images/StatesDMC-DA/MEAP/5thGr/MEAP-5-2005-14.png},{img:images/StatesDMC-DA/MEAP/5thGr/MEAP-5-2005-15.png},The picture below shows the life cycle of a gypsy moth. {img:images/StatesDMC-DA/MEAP/5thGr/MEAP-5-2005-11.png} During which stage of its life cycle is the gypsy moth most likely to cause damage to crops?,5,,Test
D,MEAP_2005_5_26,{img:images/StatesDMC-DA/MEAP/5thGr/MEAP-5-2005-17.png},{img:images/StatesDMC-DA/MEAP/5thGr/MEAP-5-2005-18.png},{img:images/StatesDMC-DA/MEAP/5thGr/MEAP-5-2005-19.png},{img:images/StatesDMC-DA/MEAP/5thGr/MEAP-5-2005-20.png},{img:images/StatesDMC-DA/MEAP/5thGr/MEAP-5-2005-16.png} Look at the beaver tail in the picture above. This tail is adapted to help the beaver move swiftly through the water when swimming. Which of the following foot structures most likely belongs to the beaver?,5,,Test
C,MEAP_2005_5_36,Shadows do not occur in buildings.,Ceiling lights do not produce shadows.,There are multiple light sources in the classroom.,The windows are on only one side of the room.,{img:images/StatesDMC-DA/MEAP/5thGr/MEAP-5-2005-26.png} The picture above shows a typical classroom setup. Why would shadows be difficult to see in this room?,5,,Test
C,MEAP_2005_5_42,The dog is pulling on the ground and pulling on the rope.,The dog is pulling on the ground and pushing on the rope.,The dog is pushing off the ground and pulling on the rope.,The dog is pushing off the ground and pushing on the rope.,{img:images/StatesDMC-DA/MEAP/5thGr/MEAP-5-2005-27.png} Which of the following best describes the forces being used by the dog?,5,,Test
D,MEAP_2005_5_43,gears and inclined plane,lever and wheel and axle,pulley and inclined plane,inclined plane and wheel and axle,{img:images/StatesDMC-DA/MEAP/5thGr/MEAP-5-2005-28.png} Which combination of simple machines is the worker using to move these boxes into the truck?,5,,Test
D,MEAP_2005_5_5,Portland,Cincinnati,Louisville,Naples,{img:images/StatesDMC-DA/MEAP/5thGr/MEAP-5-2005-2.png} Which city on the map is least likely to experience snowfall during the winter months?,5,,Test
A,MEAP_2005_5_6,reduce waste,reuse materials,recycle resources,renew energy sources,"Tyrone taped a list of things to do on his mirror so he would not forget to do them. The list included the following tasks: {img:images/StatesDMC-DA/MEAP/5thGr/MEAP-5-2005-3.png} Based on Tyrone's list, what is he trying to accomplish by performing these tasks?",5,,Test
A,MEAP_2005_5_8,one 24-hour day,one 7-day week,one full month,one full year,"Using the diagram below and what you know about Earth, answer the question. {img:images/StatesDMC-DA/MEAP/5thGr/MEAP-5-2005-4.png} After Earth completes one full rotation (spin) on its axis, how much time has passed?",5,,Test
D,NCEOGA_2013_5_2,{img:images/StatesDMC-DA/NorthCarolina/5thGr/NC-5-2013-1.png},{img:images/StatesDMC-DA/NorthCarolina/5thGr/NC-5-2013-2.png},{img:images/StatesDMC-DA/NorthCarolina/5thGr/NC-5-2013-3.png},{img:images/StatesDMC-DA/NorthCarolina/5thGr/NC-5-2013-4.png},Which graph represents an object that is decreasing in speed?,5,,Test
B,NYSEDREGENTS_2008_4_1,1 and 2,2 and 3,3 and 4,4 and 5,"A student put five ring magnets on a pencil. The magnets are labeled 1, 2, 3, 4, and 5. {img:images/NYSEDREGENTS/2008_4th_Grade/01.PNG} Which two magnets are attracting each other?",4,,Test
D,NYSEDREGENTS_2008_4_13,The battery is out of energy.,The bulb is out of energy.,The circuit is opened.,The circuit is closed.,The diagram below shows a bulb and a wire attached to a battery. {img:images/NYSEDREGENTS/2008_4th_Grade/03.PNG} Why would this bulb be lit?,4,,Test
D,NYSEDREGENTS_2008_4_14,balance,pulley,lever,inclined plane,The diagram below shows a person rolling a barrel into the back of a truck. {img:images/NYSEDREGENTS/2008_4th_Grade/04.PNG} What simple machine is the person using to help roll the barrel?,4,,Test
B,NYSEDREGENTS_2008_4_16,tree and rope,tire and rope,grass and tire,grass and tree,The diagram below shows several objects. {img:images/NYSEDREGENTS/2008_4th_Grade/05.PNG} Which objects in the picture are nonliving?,4,,Test
D,NYSEDREGENTS_2008_4_19,food chain,food supply,life span,life cycle,The diagram below shows the growth of a tree. {img:images/NYSEDREGENTS/2008_4th_Grade/06.PNG} This diagram represents a,4,,Test
A,NYSEDREGENTS_2008_4_22,by wind,in water,on an animal's fur,eaten by animals,Two seeds are shown in the diagram below. {img:images/NYSEDREGENTS/2008_4th_Grade/07.PNG} How are these seeds most likely dispersed?,4,,Test
B,NYSEDREGENTS_2008_4_29,blue,green,red,yellow,The chart below shows three properties of five objects. {img:images/NYSEDREGENTS/2008_4th_Grade/08.PNG} What color is the round object that has a rough surface?,4,,Test
B,NYSEDREGENTS_2008_4_30,{img:images/NYSEDREGENTS/2008_4th_Grade/09.PNG},{img:images/NYSEDREGENTS/2008_4th_Grade/10.PNG},{img:images/NYSEDREGENTS/2008_4th_Grade/11.PNG},{img:images/NYSEDREGENTS/2008_4th_Grade/12.PNG},A group of students wants to record the change in temperature of a container of water every 2 minutes for a period of 10 minutes. Which table will best organize these data?,4,,Test
D,NYSEDREGENTS_2008_4_9,gravity,weather,revolution,rotation,The diagram below shows a view of Earth. {img:images/NYSEDREGENTS/2008_4th_Grade/02.PNG} The arrows represent Earth's,4,,Test
C,NYSEDREGENTS_2010_4_12,43 mL,45 mL,47 mL,49 mL,Base your answers on the diagram below and on your knowledge of science. The diagram shows four identical marbles and a graduated cylinder containing 43 mL of water. {img:images/NYSEDREGENTS/2010_4th_Grade/03.PNG} A student puts two marbles in the cylinder and the water level rises from 43 mL to 45 mL. The student then puts the other two marbles in the graduated cylinder. What will the water level be when all four marbles are in the graduated cylinder?,4,,Test
D,NYSEDREGENTS_2010_4_13,color,shape,texture,volume,Base your answers on the diagram below and on your knowledge of science. The diagram shows four identical marbles and a graduated cylinder containing 43 mL of water. {img:images/NYSEDREGENTS/2010_4th_Grade/03.PNG} Which property of the marbles causes the water level to rise when they are put in the graduated cylinder?,4,,Test
B,NYSEDREGENTS_2010_4_14,magnet,battery,metal nail,second lightbulb,An incomplete electric circuit is shown below. The lightbulb is not lit. {img:images/NYSEDREGENTS/2010_4th_Grade/04.PNG} Which object placed at X would complete the circuit and light the bulb?,4,,Test
D,NYSEDREGENTS_2010_4_28,{img:images/NYSEDREGENTS/2010_4th_Grade/05.PNG},{img:images/NYSEDREGENTS/2010_4th_Grade/06.PNG},{img:images/NYSEDREGENTS/2010_4th_Grade/07.PNG},{img:images/NYSEDREGENTS/2010_4th_Grade/08.PNG},Which diagram shows the order of the stages in the butterfly's life cycle?,4,,Test
C,NYSEDREGENTS_2010_4_5,condensation,evaporation,erosion,magnetism,The diagram below shows an area of land that changed after many years. {img:images/NYSEDREGENTS/2010_4th_Grade/01.PNG} Which process changed the shape of the rock layers over time?,4,,Test
D,NYSEDREGENTS_2010_4_6,circuits,magnets,measurement tools,simple machines,The pulley and lever shown below use mechanical energy to move an object. {img:images/NYSEDREGENTS/2010_4th_Grade/02.PNG} The pulley and lever are examples of,4,,Test
A,NYSEDREGENTS_2012_4_15,food,mates,predators,camouflage,Base your answers on the diagram below and on your knowledge of science. The diagram shows some organisms living together. {img:images/NYSEDREGENTS/2012_4th_Grade/01.PNG} The baby birds in the nest are competing for,4,,Test
D,NYSEDREGENTS_2012_4_16,blue jay and woodpecker,beetle and squirrel,worm and leaves,tree and grass,Base your answers on the diagram below and on your knowledge of science. The diagram shows some organisms living together. {img:images/NYSEDREGENTS/2012_4th_Grade/01.PNG} Which two organisms in this diagram are producers?,4,,Test
C,NYSEDREGENTS_2012_4_24,They absorb sunlight.,They provide support for the plant.,They keep animals away from the plant.,They carry food to the flower.,The photograph below shows a cactus plant covered with sharp spines. {img:images/NYSEDREGENTS/2012_4th_Grade/02.PNG} How do the sharp spines on the cactus help it to survive?,4,,Test
B,NYSEDREGENTS_2012_4_25,Life Cycles of Some Animals,Life Spans of Some Animals,Life Processes of Some Animals,Life Functions of Some Animals,The graph below shows information about several animals. {img:images/NYSEDREGENTS/2012_4th_Grade/03.PNG} What is the best title for this graph?,4,,Test
A,NYSEDREGENTS_2012_4_27,crickets,hawks,snakes,plants,"Base your answers on the food chain below and on your knowledge of science {img:images/NYSEDREGENTS/2012_4th_Grade/04.PNG} If the number of frogs decreases, which population will most likely increase?",4,,Test
A,NYSEDREGENTS_2012_4_28,hawks and snakes,hawks and plants,frogs and crickets,frogs and plants,Base your answers on the food chain below and on your knowledge of science {img:images/NYSEDREGENTS/2012_4th_Grade/04.PNG} Two predators shown in the diagram are,4,,Test
A,NYSEDREGENTS_2012_4_30,2 cm,3 cm,4 cm,5 cm,"Two candles, A and B, were the same size. Candle B was lit and burned for an hour. After the hour, the candles were measured, as shown in the diagram below. {img:images/NYSEDREGENTS/2012_4th_Grade/05.PNG} How many centimeters shorter is candle B after it burned for an hour?",4,,Test
D,NYSEDREGENTS_2013_4_11,1,2,7,14,The diagram below shows Earth rotating. {img:images/NYSEDREGENTS/2013_4th_Grade/08.PNG} What is the total number of complete rotations that Earth makes in 2 weeks?,4,,Test
A,NYSEDREGENTS_2013_4_15,light,air,water,nutrients,Two plants of the same species and size were planted in identical pots of soil. One pot was placed in a window and the other was placed on a table. Both plants were given the same amount of water and nutrients. The diagram below shows the two plants after 1 month. {img:images/NYSEDREGENTS/2013_4th_Grade/09.PNG} The plant in the window grew bigger because it received more,4,,Test
C,NYSEDREGENTS_2013_4_16,migrations,hibernations,physical adaptations,seasonal changes,The diagram below shows the beaks of three different birds. Birds use their beaks to obtain food. {img:images/NYSEDREGENTS/2013_4th_Grade/10.PNG} The differences in the birds' beaks are examples of,4,,Test
D,NYSEDREGENTS_2013_4_18,A,B,C,D,"Two tanks with fish are shown below. Parent fish are in tank 1. The fish in tank 2 are labeled A, B, C, and D. {img:images/NYSEDREGENTS/2013_4th_Grade/11.PNG} Which fish in tank 2 is most likely the offspring of the two parent fish in tank 1?",4,,Test
A,NYSEDREGENTS_2013_4_2,{img:images/NYSEDREGENTS/2013_4th_Grade/01.PNG},{img:images/NYSEDREGENTS/2013_4th_Grade/02.PNG},{img:images/NYSEDREGENTS/2013_4th_Grade/03.PNG},{img:images/NYSEDREGENTS/2013_4th_Grade/04.PNG},"The four diagrams below show two magnets, X and Z. They are different distances apart in each diagram. In which diagram will magnet Z have the strongest attraction to magnet X?",4,,Test
B,NYSEDREGENTS_2013_4_25,are eaten by animals,attach to an animal's fur,germinate in the soil,develop in the water,"The photograph below shows burdock seeds. The seeds are inside a structure with thin, sharp hooks. {img:images/NYSEDREGENTS/2013_4th_Grade/12.PNG} These seeds will most likely be dispersed when they",4,,Test
C,NYSEDREGENTS_2013_4_27,hawks,snakes,crickets,plants,"Base your answers on the food chain below and on your knowledge of science. {img:images/NYSEDREGENTS/2013_4th_Grade/13.PNG} If the number of frogs suddenly increases, which population will most likely decrease first?",4,,Test
A,NYSEDREGENTS_2013_4_28,Sun,plants,frogs,hawks,Base your answers on the food chain below and on your knowledge of science. {img:images/NYSEDREGENTS/2013_4th_Grade/13.PNG} What is the main source of energy for all the organisms in this food chain?,4,,Test
C,NYSEDREGENTS_2013_4_30,28F,34F,46F,60F,"The data table below shows some average monthly air temperatures for a city in New York State. The average air temperature for the month of April is not shown. {img:images/NYSEDREGENTS/2013_4th_Grade/14.PNG} Based on the data, what would the average air temperature probably have been in April?",4,,Test
D,NYSEDREGENTS_2013_4_5,inclined plane,lever,magnet,pulley,The diagram below shows a person using a tool to lift a box. {img:images/NYSEDREGENTS/2013_4th_Grade/05.PNG} Which tool is being used?,4,,Test
A,NYSEDREGENTS_2013_4_6,erosion and deposition,erosion and magnetism,gravity and evaporation,gravity and condensation,The diagrams below show side views of an area of land near the ocean. The diagrams show how this area changed over a period of time. {img:images/NYSEDREGENTS/2013_4th_Grade/06.PNG} The changes to the land shown in the diagram were most likely caused by,4,,Test
B,NYSEDREGENTS_2013_4_9,magnetism,gravity,electricity,friction,The diagram below shows the path of a soccer ball as it travels from start to finish. The arrow represents a force acting on the ball. {img:images/NYSEDREGENTS/2013_4th_Grade/07.PNG} Which force is represented by the arrow?,4,,Test
C,NYSEDREGENTS_2015_4_1,A,B,C,D,"Base your answers on the food chain below and on your knowledge of science. Four organisms in the food chain are labeled A, B, C, and D. {img:images/NYSEDREGENTS/2015_4th_Grade/01.PNG} Which organism in this food chain is both predator and prey?",4,,Test
A,NYSEDREGENTS_2015_4_2,decrease,increase,remain the same,,"Base your answers on the food chain below and on your knowledge of science. Four organisms in the food chain are labeled A, B, C, and D. {img:images/NYSEDREGENTS/2015_4th_Grade/01.PNG} If the population of organism A decreases, the population of organism B would most likely",4,,Test
A,NYSEDREGENTS_2015_4_20,A,B,C,D,"The diagram below shows a flower that contains a sweet liquid called nectar. {img:images/NYSEDREGENTS/2015_4th_Grade/04.PNG} Four birds, labeled A, B, C, and D, are shown below. The birds eat different foods. {img:images/NYSEDREGENTS/2015_4th_Grade/05.PNG} Which bird's beak will make it easiest to get nectar out of the flower?",4,,Test
C,NYSEDREGENTS_2015_4_21,flower,leaf,roots,stem,"Base your answer on the diagram of a flowering plant below and on your knowledge of science. Four structures that help the plant to survive, grow, and reproduce are labeled. {img:images/NYSEDREGENTS/2015_4th_Grade/06.PNG} Which structure takes in water and nutrients from the soil?",4,,Test
A,NYSEDREGENTS_2015_4_22,flower,leaf,roots,stem,"Base your answer on the diagram of a flowering plant below and on your knowledge of science. Four structures that help the plant to survive, grow, and reproduce are labeled. {img:images/NYSEDREGENTS/2015_4th_Grade/06.PNG} Which structure produces seeds for reproduction?",4,,Test
C,NYSEDREGENTS_2015_4_3,1 month,3 months,6 months,9 months,The diagram below shows Earth revolving around the Sun. Letters A and B show two locations in Earth's orbit around the Sun. {img:images/NYSEDREGENTS/2015_4th_Grade/02.PNG} It takes Earth one year to revolve around the Sun. How long will it take for Earth to travel from point A to point B?,4,,Test
B,NYSEDREGENTS_2015_4_9,4.0,4.5,5.0,5.5,The diagram below shows a pencil being measured with paper clips. {img:images/NYSEDREGENTS/2015_4th_Grade/03.PNG} What is the length of the pencil in paper clips?,4,,Test
A,OHAT_2007_5_1,Light is refracted as it moves from air to water.,Light is reflected as it moves from air to water.,Light is absorbed as it moves from air to water.,Light is destroyed as it moves from air to water.,An air hose extends above and below the surface of the water. {img:images/StatesDMC-DA/Ohio/5thGr/OH-5-2007-1.png} Which statement explains why the air hose looks broken at the surface of the water?,5,,Test
C,OHAT_2007_5_25,The hot plate is turned on.,The temperature increases.,The water bubbles and the steam is visible.,The mass of water in the beaker increases.,A teacher put a beaker of water on a hot plate. The beaker is shown before and after the hot plate is turned on. {img:images/StatesDMC-DA/Ohio/5thGr/OH-5-2007-13.png} What is the evidence that water is changing state?,5,,Test
C,OHAT_2007_5_33,sound,gravity,thermal,magnetic,Electric energy flows through the wire filament in a light bulb. The energy flow causes the wire to glow and give off light. {img:images/StatesDMC-DA/Ohio/5thGr/OH-5-2007-17.png} Which type of energy produces this light?,5,,Test
B,OHAT_2007_5_36,hawk and black bear,beaver and black bear,hawk and potato beetle,beaver and potato beetle,Use the following table to answer the question. {img:images/StatesDMC-DA/Ohio/5thGr/OH-5-2007-19.png} A student created this table for a report on animals that can be found in Ohio. Which animals give birth to live young?,5,,Test
C,OHAT_2007_5_7,near position 1,near position 2,near position 3,near position 4,The diagram shows the position of Earth [E] now. {img:images/StatesDMC-DA/Ohio/5thGr/OH-5-2007-4.png} Where will Earth be in six months?,5,,Test
A,OHAT_2008_5_2,plant,hawk,mouse,grasshopper,"Use the following food web to answer the question. {img:images/StatesDMC-DA/Ohio/5thGr/OH-5-2008-2.png} In this food web, which organism captures the sun's energy?",5,,Test
A,OHAT_2009_5_12,{img:images/StatesDMC-DA/Ohio/5thGr/OH-5-2009-9.png},{img:images/StatesDMC-DA/Ohio/5thGr/OH-5-2009-10.png},{img:images/StatesDMC-DA/Ohio/5thGr/OH-5-2009-11.png},{img:images/StatesDMC-DA/Ohio/5thGr/OH-5-2009-12.png},Which diagram correctly shows the orbits of Earth [E] and the moon [M] around the sun [S]?,5,,Test
D,OHAT_2009_5_39,underneath a gutter along a roof,hanging from the branch of a tree,on the ground next to the building,on top of a fence post in an open area,Students are investigating the amount of rain their school receives during one spring. They have a rain gauge to measure how much rain falls each week. {img:images/StatesDMC-DA/Ohio/5thGr/OH-5-2009-27.png} Where should they place the rain gauge to collect the most accurate data?,5,,Test
B,OHAT_2010_5_10,raindrops falling on the sand,wind blowing across the surface of the dune,tracks left in the sand as animals look for food,vibrations caused by earthquakes under the dune,Use the information below to answer the question. Sand dunes often have a wavy surface. {img:images/StatesDMC-DA/Ohio/5thGr/OH-5-2010-4.png} What creates this kind of surface?,5,,Test
C,OHAT_2010_5_3,melts/does not melt,wood/not wood,metal/not metal,sharp/not sharp,"A group of students separated the objects in the list into two groups. * Candle * Coin * Crayon * Match * Nail * Pencil * Tack * Wire The table shows how the students grouped the objects. {img:images/StatesDMC-DA/Ohio/5thGr/OH-5-2010-1.png} According to this information, what physical characteristics did the students use to group the objects?",5,,Test
B,OHAT_2010_5_40,student 1,student 2,student 3,student 4,"Four students are each given the following materials: brick, iron nail, rubber band, salt water, dry wooden stick The teacher tells each student to sort the materials into two groups: those that conduct electricity and those that do not. {img:images/StatesDMC-DA/Ohio/5thGr/OH-5-2010-15.png} Which student correctly sorted the materials by the ability to conduct electricity?",5,,Test
B,OHAT_2010_5_44,Plants absorb water from the wet soil.,Plant roots hold soil particles together.,Plant leaves release water from the soil into the air.,Plants decrease moisture evaporation from the soil.,Use the following pictures to answer the question. {img:images/StatesDMC-DA/Ohio/5thGr/OH-5-2010-16.png} How do these plants slow soil erosion caused by heavy rains?,5,,Test
C,OHAT_2011_5_17,{img:images/StatesDMC-DA/Ohio/5thGr/OH-5-2011-5.png},{img:images/StatesDMC-DA/Ohio/5thGr/OH-5-2011-6.png},{img:images/StatesDMC-DA/Ohio/5thGr/OH-5-2011-7.png},{img:images/StatesDMC-DA/Ohio/5thGr/OH-5-2011-8.png},Use the following information and picture of a beetle to answer the question. {img:images/StatesDMC-DA/Ohio/5thGr/OH-5-2011-4.png} The use of which tool allows the student to easily observe the beetle's legs as it is walking across the desk?,5,,Test
A,OHAT_2011_5_44,from the east,from the west,from the north,from the south,"A student is collecting data about the wind. The picture shows a windsock attached to a flagpole on a windy day. {img:images/StatesDMC-DA/Ohio/5thGr/OH-5-2011-16.png} According to the information in the picture, the wind is coming from which direction?",5,,Test
C,TAKS_2009_5_15,{img:images/StatesDMC-DA/TAKS/5thGr/TX-5-2009-11.png},{img:images/StatesDMC-DA/TAKS/5thGr/TX-5-2009-12.png},{img:images/StatesDMC-DA/TAKS/5thGr/TX-5-2009-13.png},{img:images/StatesDMC-DA/TAKS/5thGr/TX-5-2009-14.png},"Some students added 500 milliliters of water to equal amounts of four different samples of soil. In this investigation, which sample of soil held the most water?",5,,Test
D,TAKS_2009_5_16,Q,R,S,T,The pictures below show how the monarch butterfly uses the milkweed plant. {img:images/StatesDMC-DA/TAKS/5thGr/TX-5-2009-15.png} Which picture shows the stage at which the monarch butterfly helps the milkweed plant reproduce?,5,,Test
B,TAKS_2009_5_27,Bobcats,Bighorn sheep,Bacteria,Bronze frogs,"{img:images/StatesDMC-DA/TAKS/5thGr/TX-5-2009-22.png} According to the table shown above, elk most likely compete with which organisms for food?",5,,Test
D,TAKS_2009_5_3,metal conducts heat,energy is absorbed,metal is magnetic,air vibrates,"{img:images/StatesDMC-DA/TAKS/5thGr/TX-5-2009-1.png} A student plays the cymbals in a band. When the cymbals are hit together, a loud sound is produced. The force of the cymbals hitting each other produces sound because -",5,,Test
B,TAKS_2009_5_31,Island,Glacier,River,Volcano,{img:images/StatesDMC-DA/TAKS/5thGr/TX-5-2009-23.png} Which of the following features is best modeled in the diagram above?,5,,Test
A,TAKS_2009_5_40,were made for children,have different flavors,are easy to chew,have a pleasant taste,"{img:images/StatesDMC-DA/TAKS/5thGr/TX-5-2009-27.png} The picture shows the label for a new product. Based on the label, the reader can conclude that the tablets -",5,,Test
C,TAKS_2009-A_5_15,1-3,4-8,9-18,,Look at the advertisement below. It shows how much calcium a person needs for growing strong bones and teeth. {img:images/StatesDMC-DA/TAKS/5thGr/TX-5-2009-33.png} In which of these age groups do a person's teeth and bones most likely grow the most?,5,,Test
B,TAKS_2009-A_5_18,R,S,T,,Look at the bar graph below. It shows the total amount of rainfall in three different cities for one year. {img:images/StatesDMC-DA/TAKS/5thGr/TX-5-2009-34.png} Which city had the driest year?,5,,Test
B,TAKS_2009-A_5_20,respiration,evaporation,precipitation,,{img:images/StatesDMC-DA/TAKS/5thGr/TX-5-2009-35.png} Ten hours ago the towel shown above was wet. Now it is dry. This is the result of -,5,,Test
B,TAKS_2009-A_5_23,R,S,T,,"Look at the picture of the tree rings R, S, and T below. Each tree ring shows how much the tree grew in one year. {img:images/StatesDMC-DA/TAKS/5thGr/TX-5-2009-37.png} Which tree ring shows the least amount of growth for the year?",5,,Test
B,TAKS_2009-A_5_24,The actual size of Earth,The location of landmasses on Earth,The distance between Earth and the sun,,A teacher showed the science class a globe like the one below. {img:images/StatesDMC-DA/TAKS/5thGr/TX-5-2009-38.png} What can be learned about Earth by studying a globe like this?,5,,Test
B,TAKS_2009-A_5_26,Plant 1 received more oxygen.,Plant 1 received more water.,Plant 1 received fewer minerals.,,Look at the plants below. {img:images/StatesDMC-DA/TAKS/5thGr/TX-5-2009-39.png} What is the most likely reason Plant 1 looks different from Plant 2?,5,,Test
C,TAKS_2009-A_5_30,34C,25C,22C,,Look at the thermometer below. {img:images/StatesDMC-DA/TAKS/5thGr/TX-5-2009-41.png} What is the temperature reading on this thermometer?,5,,Test
D,VASoL_2007_3_12,{img:images/StatesDMC-DA/Virginia/3rdGr/VA-3-2007-12.png},{img:images/StatesDMC-DA/Virginia/3rdGr/VA-3-2007-13.png},{img:images/StatesDMC-DA/Virginia/3rdGr/VA-3-2007-14.png},{img:images/StatesDMC-DA/Virginia/3rdGr/VA-3-2007-15.png},{img:images/StatesDMC-DA/Virginia/3rdGr/VA-3-2007-11.png} Which graph BEST shows how many of each fish are in the tank?,3,,Test
B,VASoL_2007_3_14,{img:images/StatesDMC-DA/Virginia/3rdGr/VA-3-2007-16.png},{img:images/StatesDMC-DA/Virginia/3rdGr/VA-3-2007-17.png},{img:images/StatesDMC-DA/Virginia/3rdGr/VA-3-2007-18.png},{img:images/StatesDMC-DA/Virginia/3rdGr/VA-3-2007-19.png},"Salamanders have a tail, smooth skin, and feet with no claws. Which of these animals is a salamander?",3,,Test
