answerKey,id,A,B,C,D,stem,Grade,subject,category
C,ACTAAP_2008_5_16,feed on water plants,perform photosynthesis,eat snails and mosquito larvae,live in warm areas of the pond,The diagram below represents an aquatic food web. {img:images/States2017/AK/AK_Gr5_2008_3.png} What must the fish do to gain energy from the Sun?,5,science,Dev
D,LEAP__5_10328,the amount that each plant grew,the amount of food each plant received,the amount of water each plant received,the amount of sunlight each plant received,Use the data table below to answer the question. {img:images/States2017/LA/LA_no_year_5thGr_1.png} Maria grew four plants in an experiment about plant growth. The table shows the design and results of Maria's experiment. What was the independent variable in this investigation?,5,science,Dev
A,LEAP__5_10333,{img:images/States2017/LA/LA_no_year_5thGr_15.png},{img:images/States2017/LA/LA_no_year_5thGr_16.png},{img:images/States2017/LA/LA_no_year_5thGr_17.png},{img:images/States2017/LA/LA_no_year_5thGr_18.png},Which foot would most likely help a bird live in water?,5,science,Dev
C,LEAP__5_10335,{img:images/States2017/LA/LA_no_year_5thGr_3.png},{img:images/States2017/LA/LA_no_year_5thGr_4.png},{img:images/States2017/LA/LA_no_year_5thGr_5.png},{img:images/States2017/LA/LA_no_year_5thGr_6.png},A scientist was studying a mammal population. The data table below shows some of her results. {img:images/States2017/LA/LA_no_year_5thGr_2.png} Which graph best represents the information in the table?,5,science,Dev
A,MCAS_1998_4_21,plant,frog,rabbit,hawk,{img:images/States2017/Mass/Mass_4thGr_1998_19.png} What organism most likely belongs in the circle?,4,science,Dev
C,MCAS_1998_4_5,{img:images/States2017/Mass/Mass_4thGr_1998_3.png},{img:images/States2017/Mass/Mass_4thGr_1998_4.png},{img:images/States2017/Mass/Mass_4thGr_1998_5.png},{img:images/States2017/Mass/Mass_4thGr_1998_6.png},Which picture correctly shows where the shadow would be?,4,science,Dev
C,MCAS_1999_4_22,light energy only.,heat and mechanical energy.,light and heat energy.,light and mechanical energy.,{img:images/States2017/Mass/Mass_4thGr_1999_6.png} A light bulb changes electrical energy into,4,science,Dev
D,MCAS_2000_4_12,The glass was placed in the refrigerator for 10 minutes.,Cold water was added to the glass.,The glass was taken from a sunny place and put in a shady place.,The glass was placed in warm water.,Use the pictures to answer the question. Which might have happened to the glass in Picture A to cause the temperature to change as shown in Picture B? {img:images/States2017/Mass/Mass_4thGr_2000_5.png},4,science,Dev
A,MCAS_2001_5_1,evaporation,condensation,precipitation,groundwater,Use the diagram below to answer the question. {img:images/States2017/Mass/Mass_5thGr_2001_1.png} Which part of the water cycle is represented by arrow 3?,5,science,Dev
C,MCAS_2002_5_9,{img:images/States2017/Mass/Mass_5thGr_2002_10.png},{img:images/States2017/Mass/Mass_5thGr_2002_11.png},{img:images/States2017/Mass/Mass_5thGr_2002_12.png},{img:images/States2017/Mass/Mass_5thGr_2002_13.png},An engineer is trying to design a faster submarine. Which of the following animals would be most useful for the engineer to study?,5,science,Dev
B,MCAS_2003_5_23,absorb water.,make food.,protect flowers.,produce seeds.,The diagram below shows a plant. {img:images/States2017/Mass/Mass_5thGr_2003_33.png} The primary purpose of structure 3 is to,5,science,Dev
C,MCAS_2003_5_25,{img:images/States2017/Mass/Mass_5thGr_2003_34.png},{img:images/States2017/Mass/Mass_5thGr_2003_35.png},{img:images/States2017/Mass/Mass_5thGr_2003_36.png},{img:images/States2017/Mass/Mass_5thGr_2003_37.png},Which set of magnets shown below will be attracted to each other?,5,science,Dev
D,MCAS_2004_5_17,{img:images/States2017/Mass/Mass_5thGr_2004_12.png},{img:images/States2017/Mass/Mass_5thGr_2004_13.png},{img:images/States2017/Mass/Mass_5thGr_2004_14.png},{img:images/States2017/Mass/Mass_5thGr_2004_15.png},Which of the following objects will affect the direction that a compass needle points?,5,science,Dev
D,MCAS_2004_5_29,a lever.,a wedge.,a simple gear.,an inclined plane.,The picture shows a ladder leaning against a wall. {img:images/States2017/Mass/Mass_5thGr_2004_25.png} A person climbing this ladder is using the ladder as,5,science,Dev
B,MCAS_2004_5_31,to make food,to absorb water,to produce seeds,to release oxygen,The diagram below shows a bean seed that is beginning to germinate in soil. The first structure to emerge is labeled X. {img:images/States2017/Mass/Mass_5thGr_2004_26.png} What is the function of structure X?,5,science,Dev
C,MCAS_2005_5_20,calcite.,fluorite.,apatite.,topaz.,"Kendra has a mineral that she wants to identify. It is white in color, has a glassy luster, and has a hardness of 5. The table below shows some properties of selected minerals. {img:images/States2017/Mass/Mass_5thGr_2005_8.png} Based on the information in the table, Kendra's mineral is most similar to",5,science,Dev
A,MCAS_2006_5_10,fur,claws,big ears,webbed feet,The pictures below show animals from different parts of the world. {img:images/States2017/Mass/Mass_5thGr_2006_15.png} Which of the following characteristics do all of these animals have that allows them to be classified in the same group?,5,science,Dev
C,MCAS_2006_5_16,a wrench and a hammer,a hammer and a saw,a wrench and a screwdriver,a screwdriver and a saw,The picture below shows a nut and a bolt. {img:images/States2017/Mass/Mass_5thGr_2006_24.png} Which of the following hand tools would most likely be used to tighten this nut and bolt?,5,science,Dev
A,MCAS_2006_5_30,landslide,snowfall,wind erosion,volcanic eruption,The picture below shows the result of a geological event that changed a mountain rapidly. {img:images/States2017/Mass/Mass_5thGr_2006_45.png} Which of the following most likely caused the rapid change of the mountain?,5,science,Dev
B,MCAS_2006_5_36,insects that feed on plants,small fish in shallow water,nuts from riverside trees and plants,birds in ground nests,"The picture below shows a bird. {img:images/States2017/Mass/Mass_5thGr_2006_51.png} From the shape of its beak and the length of its legs, this bird is best adapted for feeding on which of the following?",5,science,Dev
D,MCAS_2006_5_4,color,dryness,hardness,strength,The picture below shows two trees and the beginning of a treehouse. {img:images/States2017/Mass/Mass_5thGr_2006_7.png} A group of friends is building a treehouse. They are using straight wooden boards to build a platform between two trees. Which of the following is the most important characteristic of the board they have put between the two trees?,5,science,Dev
B,MCAS_2016_5_10,The crane operator turns on a magnetic charge in the scrap metal.,The crane operator turns off an electric current in the electromagnet.,The crane operator sends out a signal that causes the train car to become an electromagnet.,The crane operator sends out a signal that blocks the magnetic properties of the scrap metal.,"A crane operator uses a crane with an electromagnet to move scrap metal over a train car, as shown below. {img:images/States2017/Mass/Mass_5thGr_2016_6.png} Which of the following statements describes what the crane operator does to drop the scrap metal into the train car?",5,science,Dev
A,MEA_2013_5_5,"The animals in Group 1 cannot fly, and the animals in Group 2 can fly.","The animals in Group 1 are mammals, and the animals in Group 2 are not mammals.","The animals in Group 1 have feathers, and the animals in Group 2 do not have feathers.","The animals in Group 1 do not eat plants, and the animals in Group 2 do eat plants.",The table below shows two groups of organisms. {img:images/States2017/ME/ME_5thGr_2013-2014_7.png} How are the organisms sorted into two groups?,5,science,Dev
C,MEA_2014_5_10,The ancestor elephant has fur.,The ancestor elephant has a tail.,The present-day elephant has larger tusks.,The present-day elephant has smaller feet.,"The diagram below shows a present-day elephant and an ancestor of the elephant. {img:images/States2017/ME/ME_5thGr_2014-2015_5.png} Based on the diagram, what is a major difference between the two elephants?",5,science,Dev
D,MSA_2012_5_10,air to breathe,color to the body,water for energy,energy for growth,"Giant Spider Web Envelops Texas Park {img:images/States2017/MD/MD_5thGr_2012_3.png} Entomologists are debating the origin and rarity of a sprawling spider web that blankets several trees, shrubs and the ground along a 200-yard stretch of trail in a North Texas park. Officials at Lake Tawakoni State Park say the massive mosquito trap is a big attraction for some visitors, while others will not go anywhere near it. ""At first, it was so white it looked like fairyland,"" said Donna Garde, superintendent of the park about 45 miles east of Dallas. ""Now it's filled with so many mosquitoes that it's turned a little brown. There are times you can literally hear the screech of millions of mosquitoes caught in those webs."" Spider experts say the web may have been constructed by social cobweb spiders, which work together, or could be the result of a mass dispersal in which the arachnids spin webs to spread out from one another. ""I've been hearing from entomologists from Ohio, Kansas, British Columbia-all over the place,"" said Mike Quinn, an invertebrate biologist with the Texas Parks and Wildlife Department who first posted photos online. Herbert A. ""Joe"" Pase, a Texas Forest Service entomologist, said the massive web is very unusual. ""From what I'm hearing it could be a once-in-a-lifetime event,"" he said. But John Jackman, a professor and extension entomologist for Texas A&M University, said he hears reports of similar webs every couple of years. ""There are a lot of folks that don't realize spiders do that,"" said Jackman, author of ""A Field Guide to the Spiders and Scorpions of Texas."" ""Until we get some samples sent to us, we really won't know what species of spider we're talking about,"" Jackman said. Garde invited the entomologists out to the park to get a firsthand look at the giant web. ""Somebody needs to come out that's an expert. I would love to see some entomology intern come out and study this,"" she said. Park rangers said they expect the web to last until fall, when the spiders will start dying off. The mosquitoes trapped in the giant spider web are used by the spiders to provide",5,science,Dev
B,MSA_2012_5_25,flexibility,hardness,ability to conduct heat,ability to be attracted by magnets,"The Detroit Salt Mine Company began removing salt from the ground in 1906. This underground mine covers 6 square kilometers beneath the city of Detroit, Michigan. When the mine opened, people used the salt to preserve food, make glass, and tan leather goods. Today, people use the salt to melt ice on highways during winter storms. {img:images/States2017/MD/MD_5thGr_2012_9.png} A salt mine consists of several different rocks and minerals. Which physical property of rocks and minerals is most important when considering the support of the walls in the salt mine?",5,science,Dev
A,MSA_2012_5_26,Each occupies space and contains a definite amount of material.,Each occupies space and contains the same amount of material.,All occupy the same amount of space and contain a definite amount of material.,All occupy the same amount of space and contain the same amount of material.,"The Detroit Salt Mine Company began removing salt from the ground in 1906. This underground mine covers 6 square kilometers beneath the city of Detroit, Michigan. When the mine opened, people used the salt to preserve food, make glass, and tan leather goods. Today, people use the salt to melt ice on highways during winter storms. {img:images/States2017/MD/MD_5thGr_2012_9.png} Rocks and minerals are made of matter. Which statement best describes rocks and minerals as matter?",5,science,Dev
C,MSA_2012_5_27,The total mass increases.,The total mass decreases.,The total mass stays the same.,The total mass increases and then decreases.,"The Detroit Salt Mine Company began removing salt from the ground in 1906. This underground mine covers 6 square kilometers beneath the city of Detroit, Michigan. When the mine opened, people used the salt to preserve food, make glass, and tan leather goods. Today, people use the salt to melt ice on highways during winter storms. {img:images/States2017/MD/MD_5thGr_2012_9.png} When salt is mined, machines scrape the mine walls and change salt rocks into very tiny salt crystals. What happens to the mass of 1 kilogram of salt rocks when the rocks change into very tiny salt crystals?",5,science,Dev
B,MSA_2012_5_35,{img:images/States2017/MD/MD_5thGr_2012_15.png},{img:images/States2017/MD/MD_5thGr_2012_16.png},{img:images/States2017/MD/MD_5thGr_2012_17.png},{img:images/States2017/MD/MD_5thGr_2012_18.png},A kitten is looking directly into a mirror. Which drawing best shows the image of the kitten in the mirror?,5,science,Dev
D,MSA_2012_5_5,Physical likenesses are learned.,Physical features are not inherited in birds.,The brown-headed cowbird hatched before the other hatchlings.,The brown-headed cowbird is not related to the mother of the other hatchlings.,"Brown-headed cowbirds are small birds found throughout North American grasslands and along edges of forests. For food, the brown-headed cowbirds rely on grazing animals to uncover insects and seeds. When a female brown-headed cowbird sees eggs in the nest of another bird, she lays her own egg in the nest. She usually chooses nests with eggs that are smaller than hers. The other bird species then raises the brown headed cowbird hatchling. The brown-headed cowbird hatchling grows quickly and is larger than the other hatchlings in the nest. The brown-headed cowbird often lays eggs in the nest of the yellow warbler. The yellow warbler lives near forests, builds nests in trees and thick brush, and eats insects and fruit. {img:images/States2017/MD/MD_5thGr_2012_1.png} Why is the appearance of the brown-headed cowbird hatchling different from the other hatchlings in the nest?",5,science,Dev
A,MSA_2012_5_6,decrease due to decreased nesting areas,decrease due to an increased seed supply,increase due to a decreased number of insects,increase due to increased competition with other birds,"Brown-headed cowbirds are small birds found throughout North American grasslands and along edges of forests. For food, the brown-headed cowbirds rely on grazing animals to uncover insects and seeds. When a female brown-headed cowbird sees eggs in the nest of another bird, she lays her own egg in the nest. She usually chooses nests with eggs that are smaller than hers. The other bird species then raises the brown headed cowbird hatchling. The brown-headed cowbird hatchling grows quickly and is larger than the other hatchlings in the nest. The brown-headed cowbird often lays eggs in the nest of the yellow warbler. The yellow warbler lives near forests, builds nests in trees and thick brush, and eats insects and fruit. {img:images/States2017/MD/MD_5thGr_2012_1.png} The removal of trees from the habitat of the yellow warbler would most likely cause the population of brown-headed cowbirds to",5,science,Dev
B,MSA_2012_5_7,changed to waste,digested and used for energy,digested and stored for future use,changed to sugar by the energy of the sun,"Brown-headed cowbirds are small birds found throughout North American grasslands and along edges of forests. For food, the brown-headed cowbirds rely on grazing animals to uncover insects and seeds. When a female brown-headed cowbird sees eggs in the nest of another bird, she lays her own egg in the nest. She usually chooses nests with eggs that are smaller than hers. The other bird species then raises the brown headed cowbird hatchling. The brown-headed cowbird hatchling grows quickly and is larger than the other hatchlings in the nest. The brown-headed cowbird often lays eggs in the nest of the yellow warbler. The yellow warbler lives near forests, builds nests in trees and thick brush, and eats insects and fruit. {img:images/States2017/MD/MD_5thGr_2012_1.png} When a brown-headed cowbird eats seeds and insects, most of the food is",5,science,Dev
D,MSA_2012_5_8,learned from parents,selected by the offspring,caused by the environment,inherited from parents to offspring,"Giant Spider Web Envelops Texas Park {img:images/States2017/MD/MD_5thGr_2012_3.png} Entomologists are debating the origin and rarity of a sprawling spider web that blankets several trees, shrubs and the ground along a 200-yard stretch of trail in a North Texas park. Officials at Lake Tawakoni State Park say the massive mosquito trap is a big attraction for some visitors, while others will not go anywhere near it. ""At first, it was so white it looked like fairyland,"" said Donna Garde, superintendent of the park about 45 miles east of Dallas. ""Now it's filled with so many mosquitoes that it's turned a little brown. There are times you can literally hear the screech of millions of mosquitoes caught in those webs."" Spider experts say the web may have been constructed by social cobweb spiders, which work together, or could be the result of a mass dispersal in which the arachnids spin webs to spread out from one another. ""I've been hearing from entomologists from Ohio, Kansas, British Columbia-all over the place,"" said Mike Quinn, an invertebrate biologist with the Texas Parks and Wildlife Department who first posted photos online. Herbert A. ""Joe"" Pase, a Texas Forest Service entomologist, said the massive web is very unusual. ""From what I'm hearing it could be a once-in-a-lifetime event,"" he said. But John Jackman, a professor and extension entomologist for Texas A&M University, said he hears reports of similar webs every couple of years. ""There are a lot of folks that don't realize spiders do that,"" said Jackman, author of ""A Field Guide to the Spiders and Scorpions of Texas."" ""Until we get some samples sent to us, we really won't know what species of spider we're talking about,"" Jackman said. Garde invited the entomologists out to the park to get a firsthand look at the giant web. ""Somebody needs to come out that's an expert. I would love to see some entomology intern come out and study this,"" she said. Park rangers said they expect the web to last until fall, when the spiders will start dying off. The brown body color of the social cobweb spider is",5,science,Dev
C,MSA_2012_5_9,attract birds,change color,work together,live through the winter,"Giant Spider Web Envelops Texas Park {img:images/States2017/MD/MD_5thGr_2012_3.png} Entomologists are debating the origin and rarity of a sprawling spider web that blankets several trees, shrubs and the ground along a 200-yard stretch of trail in a North Texas park. Officials at Lake Tawakoni State Park say the massive mosquito trap is a big attraction for some visitors, while others will not go anywhere near it. ""At first, it was so white it looked like fairyland,"" said Donna Garde, superintendent of the park about 45 miles east of Dallas. ""Now it's filled with so many mosquitoes that it's turned a little brown. There are times you can literally hear the screech of millions of mosquitoes caught in those webs."" Spider experts say the web may have been constructed by social cobweb spiders, which work together, or could be the result of a mass dispersal in which the arachnids spin webs to spread out from one another. ""I've been hearing from entomologists from Ohio, Kansas, British Columbia-all over the place,"" said Mike Quinn, an invertebrate biologist with the Texas Parks and Wildlife Department who first posted photos online. Herbert A. ""Joe"" Pase, a Texas Forest Service entomologist, said the massive web is very unusual. ""From what I'm hearing it could be a once-in-a-lifetime event,"" he said. But John Jackman, a professor and extension entomologist for Texas A&M University, said he hears reports of similar webs every couple of years. ""There are a lot of folks that don't realize spiders do that,"" said Jackman, author of ""A Field Guide to the Spiders and Scorpions of Texas."" ""Until we get some samples sent to us, we really won't know what species of spider we're talking about,"" Jackman said. Garde invited the entomologists out to the park to get a firsthand look at the giant web. ""Somebody needs to come out that's an expert. I would love to see some entomology intern come out and study this,"" she said. Park rangers said they expect the web to last until fall, when the spiders will start dying off. The characteristic of the social cobweb spiders that helps them survive is the ability to",5,science,Dev
C,MSA_2013_5_21,fast erosion by wind,fast weathering by wind,slow erosion by moving water,slow weathering by moving water,Students observed a creek during a field trip to a local nature center. A nature center guide explained that natural processes had formed the creek and reshaped the surface of Earth along the creek. {img:images/States2017/MD/MD_5thGr_2013_10.png} Students compared their observations of the creek with the diagram of the Grand Canyon below. {img:images/States2017/MD/MD_5thGr_2013_11.png} Which process best describes how the Grand Canyon was formed?,5,science,Dev
D,MSA_2013_5_26,the barn owl,the cardinal,the bald eagle,the wood duck,"Over time, a woodland pond filled with sediment. The habitats and food sources of four different birds are shown in the table below. {img:images/States2017/MD/MD_5thGr_2013_19.png} Which bird would most likely need to find a similar habitat in a new location after the pond fills with sediment?",5,science,Dev
C,TIMSS_1995_4_pg45,{img:images/States2017/TIMSS/TIMS_4thGr_1995_35.png},{img:images/States2017/TIMSS/TIMS_4thGr_1995_36.png},{img:images/States2017/TIMSS/TIMS_4thGr_1995_37.png},{img:images/States2017/TIMSS/TIMS_4thGr_1995_38.png},Which picture does NOT show an insect?,4,science,Dev
B,TIMSS_1995_4_pg9,Town A,Town B,Town C,Town D,This table shows the temperature and precipitation (rain or snow) in four different towns on the same day. {img:images/States2017/TIMSS/TIMS_4thGr_1995_1.png} Where did it snow?,4,science,Dev
C,TIMSS_2003_4_pg49,Figures 1 and 3,Figures 2 and 3,Figures 1 and 4,"Figures 1, 2, 3, and 4",{img:images/States2017/TIMSS/TIMSS_2003_4thGr_26.png} Which of the figures above shows a situation where two magnets repel each other?,4,science,Dev
A,TIMSS_2003_4_pg55,1 and 3 only,1 and 4 only,2 and 4 only,3 and 4 only,Which of these are insects? {img:images/States2017/TIMSS/TIMSS_2003_4thGr_34.png},4,science,Dev
B,TIMSS_2003_4_pg69,Location A,Location B,Location C,Location D,{img:images/States2017/TIMSS/TIMSS_2003_4thGr_42.png} Look at the picture above. Where is the best location to grow crops?,4,science,Dev
A,TIMSS_2007_4_pg73,{img:images/States2017/TIMSS/TIMSS_4thGr_2007_29.png},{img:images/States2017/TIMSS/TIMSS_4thGr_2007_30.png},{img:images/States2017/TIMSS/TIMSS_4thGr_2007_31.png},{img:images/States2017/TIMSS/TIMSS_4thGr_2007_32.png},Which pie chart shows the proportions of land and water on Earth?,4,science,Dev
C,TIMSS_2011_4_pg28,The sunlight warms that part of the lake.,The sky spreads sunlight over the lake.,The sunlight reflects off the lake water.,Clouds reflect sunlight into the lake.,Alice watches a sunrise from across a calm lake. She sees a sun in the sky and a sun in the lake as shown below. {img:images/States2017/TIMSS/TIMSS_4thGr_2011_12.png} Why does Alice see a sun in the lake?,4,science,Dev
A,WASL_2003_5_1,The height the toy car starts,The weight of the toy car,The angle of the ramp,,"Jane liked roller coasters, so she decided to investigate how loop-the-loops worked. She did the following investigation with the ramp and toy car shown in the diagram below. {img:images/States2017/WA/WA_5thGr_2003_1.png} Question: How high does a toy car need to be released for the toy car to travel completely around a loop? Prediction: The toy car needs to be almost 20 cm up the ramp to travel around the loop. Materials: ramp toy car meter stick to measure height in centimeters (cm) Procedure: 1. Mark the ramp at heights 5, 10, 15, 20, and 25 cm and record the heights in the data table. 2. Release the toy car from each height. 3. In the data table, record the car's motion in the loop. Data: {img:images/States2017/WA/WA_5thGr_2003_2.png} Which variable did Jane change (manipulate)?",5,science,Dev
A,WASL_2003_5_2,Release the car higher on the ramp,Increase the width of the track,Change the size of the loop,,"Jane liked roller coasters, so she decided to investigate how loop-the-loops worked. She did the following investigation with the ramp and toy car shown in the diagram below. {img:images/States2017/WA/WA_5thGr_2003_1.png} Question: How high does a toy car need to be released for the toy car to travel completely around a loop? Prediction: The toy car needs to be almost 20 cm up the ramp to travel around the loop. Materials: ramp toy car meter stick to measure height in centimeters (cm) Procedure: 1. Mark the ramp at heights 5, 10, 15, 20, and 25 cm and record the heights in the data table. 2. Release the toy car from each height. 3. In the data table, record the car's motion in the loop. Data: {img:images/States2017/WA/WA_5thGr_2003_2.png} What could Jane do to give the car more energy?",5,science,Dev
