answerKey,id,A,B,C,D,stem,Grade,subject,category
A,MEA_2011_5_8,to allow horses to run faster than their predators,to allow horses to swim faster than their ancestors,to allow horses to eat more grass,to allow horses to have more offspring,"Using the fossil foot bones of horses, scientists found that the feet of horses became longer and lost toes over a long period of time, as shown in the pictures below. {img:images/StatesDMC-DA/MEA/5thGr/MEA-5-2011-7.png} Which conclusion most likely explains why the horses' feet changed?",5,,Train
A,NYSEDREGENTS_2004_4_16,There are more hours of daylight as the month goes by.,There are fewer hours of daylight as the month goes by.,The Sun rises later as the month goes by.,The Sun sets earlier as the month goes by.,The sunrise and sunset times for three days in February are recorded in the chart below. {img:images/NYSEDREGENTS/2004_4th_Grade/01.PNG} Which statement is an accurate conclusion based on this information?,4,,Train
A,NYSEDREGENTS_2004_4_17,{img:images/NYSEDREGENTS/2004_4th_Grade/03.PNG},{img:images/NYSEDREGENTS/2004_4th_Grade/04.PNG},{img:images/NYSEDREGENTS/2004_4th_Grade/05.PNG},{img:images/NYSEDREGENTS/2004_4th_Grade/06.PNG},A group of buttons is shown in the diagram below. {img:images/NYSEDREGENTS/2004_4th_Grade/02.PNG} Which button belongs with the group of buttons shown?,4,,Train
C,NYSEDREGENTS_2004_4_18,state capitals,mountain ranges,weather conditions,animal populations,Which information is contained on this map of the United States? {img:images/NYSEDREGENTS/2004_4th_Grade/07.PNG},4,,Train
D,NYSEDREGENTS_2004_4_23,It went down 4F.,It went down 8F.,It went up 2F.,It went up 10F.,The thermometers below show the temperature of a liquid at the beginning and at the end of an experiment. {img:images/NYSEDREGENTS/2004_4th_Grade/08.PNG} How did the temperature of the liquid change from the beginning to the end of the experiment?,4,,Train
D,NYSEDREGENTS_2004_4_25,Remove wire C.,Remove the battery.,Connect wires B and C.,Connect wires A and B.,"The diagram below shows an incomplete electrical circuit that includes a battery, a bulb, and three wires labeled A, B, and C. {img:images/NYSEDREGENTS/2004_4th_Grade/09.PNG} The bulb is not lit. What should be done in order to light the bulb and complete the circuit?",4,,Train
B,NYSEDREGENTS_2004_4_26,The light will change to electricity.,The heat will travel through the wire.,The flame will get brighter.,The flame will go out.,"The drawing below shows a copper wire with a wooden handle being held in a flame. {img:images/NYSEDREGENTS/2004_4th_Grade/10.PNG} After a few minutes, what will most likely happen?",4,,Train
C,NYSEDREGENTS_2004_4_30,{img:images/NYSEDREGENTS/2004_4th_Grade/11.PNG},{img:images/NYSEDREGENTS/2004_4th_Grade/12.PNG},{img:images/NYSEDREGENTS/2004_4th_Grade/13.PNG},{img:images/NYSEDREGENTS/2004_4th_Grade/14.PNG},Two objects of the same mass are going to be placed the same distance from the support of a balance beam. Which diagram shows where the support should be placed under the beam so the objects will balance?,4,,Train
D,NYSEDREGENTS_2005_4_10,red fox,common poppy,American lobster,bristlecone pine,Base your answers on the chart below and on your knowledge of science. The chart shows the life span of several organisms. {img:images/NYSEDREGENTS/2005_4th_Grade/02.PNG} Which organism has the longest life span?,4,,Train
B,NYSEDREGENTS_2005_4_17,high tides and low tides,rain and snow,sleet and hail,cloudy and sunny,The map below shows weather conditions on a single day in the United States. {img:images/NYSEDREGENTS/2005_4th_Grade/03.PNG} Which two types of precipitation are occurring?,4,,Train
C,NYSEDREGENTS_2005_4_18,A,B,C,D,"In the diagram below, letters A, B, C, and D show processes in the water cycle. {img:images/NYSEDREGENTS/2005_4th_Grade/04.PNG} Which letter shows runoff?",4,,Train
B,NYSEDREGENTS_2005_4_21,evaporation,erosion,deposition,condensation,The diagram below shows a river flowing through a valley. {img:images/NYSEDREGENTS/2005_4th_Grade/05.PNG} Which process caused the river valley to form?,4,,Train
B,NYSEDREGENTS_2005_4_22,decrease,increase,remain the same,,"The diagram below shows a plastic cup floating in a container of water. {img:images/NYSEDREGENTS/2005_4th_Grade/06.PNG} If some marbles are placed in the cup, the water level will",4,,Train
C,NYSEDREGENTS_2005_4_23,condensation,erosion,evaporation,precipitation,"The diagram below shows three plants hanging over a table. A student watered the plants and observed water on the top of the table. The next day, the student noticed that there was no water on the table. {img:images/NYSEDREGENTS/2005_4th_Grade/07.PNG} What process had occurred?",4,,Train
A,NYSEDREGENTS_2005_4_27,a metal paper clip,a plastic bottle,a rubber band,a wooden stick,An electrical circuit is shown below. {img:images/NYSEDREGENTS/2005_4th_Grade/08.PNG} Which object at X will complete the circuit?,4,,Train
C,NYSEDREGENTS_2005_4_5,caterpillars,frogs,plants,snakes,Base your answers on the diagram of a food chain below and on your knowledge of science. {img:images/NYSEDREGENTS/2005_4th_Grade/01.PNG} Which organisms in this food chain are needed for all the other organisms to survive?,4,,Train
C,NYSEDREGENTS_2005_4_6,plants and caterpillars,caterpillars and frogs,frogs and snakes,snakes and plants,Base your answers on the diagram of a food chain below and on your knowledge of science. {img:images/NYSEDREGENTS/2005_4th_Grade/01.PNG} Which organisms in this food chain are predators?,4,,Train
A,NYSEDREGENTS_2005_4_7,decrease,increase,remain the same,,"Base your answers on the diagram of a food chain below and on your knowledge of science. {img:images/NYSEDREGENTS/2005_4th_Grade/01.PNG} If the population of snakes increases, the population of frogs will most likely",4,,Train
B,NYSEDREGENTS_2005_4_8,the stages of development of the organism,the length of time the organism lives,the basic needs of the organism,the life processes the organism performs,Base your answers on the chart below and on your knowledge of science. The chart shows the life span of several organisms. {img:images/NYSEDREGENTS/2005_4th_Grade/02.PNG} What is the life span of an organism?,4,,Train
C,NYSEDREGENTS_2005_4_9,1 minute and 1 day,1 year and 10 years,10 years and 100 years,"100 years and 1,000 years",Base your answers on the chart below and on your knowledge of science. The chart shows the life span of several organisms. {img:images/NYSEDREGENTS/2005_4th_Grade/02.PNG} The life span of an African elephant is between,4,,Train
D,NYSEDREGENTS_2006_4_1,"It increased, only.","It decreased, only.",It increased then decreased.,It decreased then increased.,Base your answers on the table below and on your knowledge of science. The table shows the weather conditions in a city at noon for five days in March. {img:images/NYSEDREGENTS/2006_4th_Grade/01.PNG} Which statement describes what happened to the temperature at noon from Tuesday through Friday?,4,,Train
B,NYSEDREGENTS_2006_4_11,pulley,inclined plane,lever,wheel,"Base your answers on the information and diagrams below. In diagram 1, a man is lifting a heavy box into a truck. In diagram 2, the same man is using a ramp to move the same box into the same truck. {img:images/NYSEDREGENTS/2006_4th_Grade/04.PNG} Which type of simple machine is the ramp in diagram 2?",4,,Train
A,NYSEDREGENTS_2006_4_12,He uses less force.,He moves the box a shorter distance.,The box is lighter.,The truck is lower.,"Base your answers on the information and diagrams below. In diagram 1, a man is lifting a heavy box into a truck. In diagram 2, the same man is using a ramp to move the same box into the same truck. {img:images/NYSEDREGENTS/2006_4th_Grade/04.PNG} Why is it easier for the man to move the same box using the ramp?",4,,Train
A,NYSEDREGENTS_2006_4_13,friction,gravity,mass,volume,"Base your answers on the information and diagrams below. In diagram 1, a man is lifting a heavy box into a truck. In diagram 2, the same man is using a ramp to move the same box into the same truck. {img:images/NYSEDREGENTS/2006_4th_Grade/04.PNG} It would be easier to move the box if the surface of the ramp was smoother because there would be less",4,,Train
D,NYSEDREGENTS_2006_4_15,A,B,C,D,Which letter in the diagram below points to the plant structure that takes in water and nutrients? {img:images/NYSEDREGENTS/2006_4th_Grade/05.PNG},4,,Train
B,NYSEDREGENTS_2006_4_17,{img:images/NYSEDREGENTS/2006_4th_Grade/06.PNG},{img:images/NYSEDREGENTS/2006_4th_Grade/07.PNG},{img:images/NYSEDREGENTS/2006_4th_Grade/08.PNG},{img:images/NYSEDREGENTS/2006_4th_Grade/09.PNG},Which diagram correctly shows the life cycle of some insects?,4,,Train
B,NYSEDREGENTS_2006_4_2,clear,cloudy,partly cloudy,mostly cloudy,Base your answers on the table below and on your knowledge of science. The table shows the weather conditions in a city at noon for five days in March. {img:images/NYSEDREGENTS/2006_4th_Grade/01.PNG} What was the sky condition on the day with the most snow?,4,,Train
B,NYSEDREGENTS_2006_4_23,the air,the Sun,water,grass,Base your answers on the diagram of a food chain below and on your knowledge of science. {img:images/NYSEDREGENTS/2006_4th_Grade/10.PNG} The energy that all organisms need to survive comes from,4,,Train
C,NYSEDREGENTS_2006_4_24,grasshopper,raccoon,grass,frog,Base your answers on the diagram of a food chain below and on your knowledge of science. {img:images/NYSEDREGENTS/2006_4th_Grade/10.PNG} Which organism is a producer?,4,,Train
B,NYSEDREGENTS_2006_4_25,prey,predator,decomposer,producer,Base your answers on the diagram of a food chain below and on your knowledge of science. {img:images/NYSEDREGENTS/2006_4th_Grade/10.PNG} The raccoon in this food chain represents a,4,,Train
A,NYSEDREGENTS_2006_4_26,decrease,increase,remain the same,,"Base your answers on the diagram of a food chain below and on your knowledge of science. {img:images/NYSEDREGENTS/2006_4th_Grade/10.PNG} If all the frogs died, the raccoon population would most likely",4,,Train
D,NYSEDREGENTS_2006_4_29,The life span of a dog is longer than the life span of a squirrel.,The life span of a lion is longer than the life span of a horse.,The life span of a squirrel is longer than the life span of a lion.,The life span of a horse is longer than the life span of a dog.,"Base your answers on the bar graph below, which shows the average life span of four animals. {img:images/NYSEDREGENTS/2006_4th_Grade/11.PNG} Which statement is supported by the data in the bar graph?",4,,Train
B,NYSEDREGENTS_2006_4_30,changes that occur as the animal develops,length of time from the animal's birth to its death,process by which the animal grows in size,transfer of specific traits to the animal's offspring,"Base your answers on the bar graph below, which shows the average life span of four animals. {img:images/NYSEDREGENTS/2006_4th_Grade/11.PNG} The life span of an animal is defined as the",4,,Train
C,NYSEDREGENTS_2006_4_6,color,odor,shape,volume,The diagram below shows liquid in a container and an empty container. {img:images/NYSEDREGENTS/2006_4th_Grade/02.PNG} All the liquid is poured into the empty container. Which property of the liquid changes?,4,,Train
C,NYSEDREGENTS_2006_4_8,color,odor,shape,texture,The diagram below shows a block of wood. {img:images/NYSEDREGENTS/2006_4th_Grade/03.PNG} The block is a solid because it has a definite,4,,Train
B,NYSEDREGENTS_2007_4_10,condensation,erosion,evaporation,rotation,The diagram below shows the land surface changes caused by a river flowing through an area for many years. {img:images/NYSEDREGENTS/2007_4th_Grade/06.PNG} Which process caused the changes shown?,4,,Train
C,NYSEDREGENTS_2007_4_11,It will decrease.,It will increase.,It will remain the same.,,"Base your answers on the diagram below and on your knowledge of science. The diagram shows two containers, A and B. Container A contains 150 milliliters of water. Container B is empty. {img:images/NYSEDREGENTS/2007_4th_Grade/07.PNG} If all of the water from container A is poured into container B, what will happen to the volume of the water?",4,,Train
C,NYSEDREGENTS_2007_4_12,mass,color,shape,state,"Base your answers on the diagram below and on your knowledge of science. The diagram shows two containers, A and B. Container A contains 150 milliliters of water. Container B is empty. {img:images/NYSEDREGENTS/2007_4th_Grade/07.PNG} If all the water from container A is poured into container B, which property of the water will change?",4,,Train
B,NYSEDREGENTS_2007_4_13,condenses into a cloud,flows on the ground,evaporates into a gas,moves downward into the ground,Base your answers on the diagram of the water cycle below and on your knowledge of science. {img:images/NYSEDREGENTS/2007_4th_Grade/08.PNG} Runoff is best described as water that,4,,Train
B,NYSEDREGENTS_2007_4_14,lake,Sun,cloud,forest,Base your answers on the diagram of the water cycle below and on your knowledge of science. {img:images/NYSEDREGENTS/2007_4th_Grade/08.PNG} What is the source of energy for the water cycle?,4,,Train
D,NYSEDREGENTS_2007_4_15,The air temperature went up steadily from Monday through Friday.,Monday and Friday were the warmest days.,The air temperature went up and then down.,The air temperature was higher on Friday than on Monday.,"The data table below shows the highest air temperature recorded each day from Monday through Friday. {img:images/NYSEDREGENTS/2007_4th_Grade/09.PNG} Based on the data table, which statement is correct?",4,,Train
B,NYSEDREGENTS_2007_4_18,rock,fish,air pump,gravel,Base your answers on the diagram below. The diagram shows some living and nonliving things in a fish tank. {img:images/NYSEDREGENTS/2007_4th_Grade/10.PNG} Which is a living thing shown in the diagram?,4,,Train
C,NYSEDREGENTS_2007_4_19,condensation,erosion,evaporation,precipitation,"Base your answers on the diagram below. The diagram shows some living and nonliving things in a fish tank. {img:images/NYSEDREGENTS/2007_4th_Grade/10.PNG} After several weeks, a student observes that the water level in the tank is lower. What process caused this to happen?",4,,Train
D,NYSEDREGENTS_2007_4_20,to make food,to provide shade,to attract animals,to protect the plant,What is the main function of the spines on the prickly cactus plant shown in the diagram below? {img:images/NYSEDREGENTS/2007_4th_Grade/11.PNG},4,,Train
A,NYSEDREGENTS_2007_4_23,It is carried by the wind.,It floats in moving water.,It passes through an animal's digestive system.,It sticks to an animal's fur.,The diagram below shows the seed of a maple tree. {img:images/NYSEDREGENTS/2007_4th_Grade/12.PNG} How is this seed most likely dispersed?,4,,Train
B,NYSEDREGENTS_2007_4_25,a learned trait,an inherited trait,a seasonal adaptation,an environmental condition,The diagram below shows a baby giraffe with its parents. {img:images/NYSEDREGENTS/2007_4th_Grade/13.PNG} The long neck on the baby giraffe is,4,,Train
B,NYSEDREGENTS_2007_4_26,A,B,C,D,The diagram below shows the stages of development of a plant. {img:images/NYSEDREGENTS/2007_4th_Grade/14.PNG} At which stage has germination begun?,4,,Train
D,NYSEDREGENTS_2007_4_28,adult,egg,larva,pupa,"The diagram below shows the life cycle of a mealworm. The stages in its life cycle are labeled W, X, Y, and Z. {img:images/NYSEDREGENTS/2007_4th_Grade/15.PNG} Which stage is shown at Y?",4,,Train
C,NYSEDREGENTS_2007_4_6,{img:images/NYSEDREGENTS/2007_4th_Grade/01.PNG},{img:images/NYSEDREGENTS/2007_4th_Grade/02.PNG},{img:images/NYSEDREGENTS/2007_4th_Grade/03.PNG},{img:images/NYSEDREGENTS/2007_4th_Grade/04.PNG},Which thermometer shows a temperature of 65F?,4,,Train
D,NYSEDREGENTS_2007_4_9,pulley,lever,wheel,inclined plane,The diagram below shows a girl in a wheelchair using a ramp to enter a building. {img:images/NYSEDREGENTS/2007_4th_Grade/05.PNG} The ramp she is using is an example of which simple machine?,4,,Train
A,NYSEDREGENTS_2009_4_11,conduct electricity,produce electricity,store electricity,stop the flow of electricity,The diagram below shows an electrical circuit. {img:images/NYSEDREGENTS/2009_4th_Grade/03.PNG} The purpose of the copper wire is to,4,,Train
C,NYSEDREGENTS_2009_4_13,condensation,deposition,erosion,evaporation,The diagram below shows the effect of a river on an area over many years. {img:images/NYSEDREGENTS/2009_4th_Grade/04.PNG} Which process caused the valley to form?,4,,Train
D,NYSEDREGENTS_2009_4_16,air,water,sunlight,shelter,The diagram below shows a lodge where beavers live. {img:images/NYSEDREGENTS/2009_4th_Grade/05.PNG} This diagram shows that beavers need trees for,4,,Train
B,NYSEDREGENTS_2009_4_18,finding a mate,competing for food,seeking shelter,migrating for winter,The diagram below shows a fox and an owl both trying to catch a rabbit. {img:images/NYSEDREGENTS/2009_4th_Grade/06.PNG} The fox and the owl are both,4,,Train
D,NYSEDREGENTS_2009_4_21,A,B,C,D,"The diagram below shows the life cycle of a frog. Four stages of development are labeled A, B, C, and D. {img:images/NYSEDREGENTS/2009_4th_Grade/07.PNG} Which letter shows the adult stage of development?",4,,Train
D,NYSEDREGENTS_2009_4_29,6 cm,12 cm,14 cm,19 cm,"The data table below shows the height of a bean plant over a three-month period. The height of the plant is recorded in centimeters (cm). {img:images/NYSEDREGENTS/2009_4th_Grade/08.PNG} If the pattern shown continues, the height of the plant in June will be",4,,Train
A,NYSEDREGENTS_2009_4_30,decrease,increase,remain the same,,"The diagram below shows a food chain. {img:images/NYSEDREGENTS/2009_4th_Grade/09.PNG} If the wheat plants died, the population of mice would most likely",4,,Train
C,NYSEDREGENTS_2009_4_6,clay,plastic,steel,,"Base your answers on the information below and on your knowledge of science. A group of students completed a float or sink experiment. They put six objects into a bucket of water. The objects were made of three different materials: clay, plastic, and steel. The diagram below shows the results of the experiment. {img:images/NYSEDREGENTS/2009_4th_Grade/01.PNG} Which material always sank in this experiment?",4,,Train
C,NYSEDREGENTS_2009_4_7,color,mass,shape,texture,"Base your answers on the information below and on your knowledge of science. A group of students completed a float or sink experiment. They put six objects into a bucket of water. The objects were made of three different materials: clay, plastic, and steel. The diagram below shows the results of the experiment. {img:images/NYSEDREGENTS/2009_4th_Grade/01.PNG} The clay boat and clay ball have the same mass. Which property causes the boat to float and the ball to sink?",4,,Train
B,NYSEDREGENTS_2009_4_8,decrease,increase,remain the same,,"The diagram below shows a glass of water and a rock. {img:images/NYSEDREGENTS/2009_4th_Grade/02.PNG} When the rock is placed into the glass, the water level will",4,,Train
D,NYSEDREGENTS_2011_4_1,50 g,100 g,150 g,200 g,The diagram below shows a balance. Side A has five blocks and side B has three blocks. The mass of each block is shown in grams (g). {img:images/NYSEDREGENTS/2011_4th_Grade/01.PNG} How much greater is the mass of the blocks on side A than the mass of the blocks on side B?,4,,Train
C,NYSEDREGENTS_2011_4_12,magnetic,electrical,sound,light,The diagram below shows a bell ringing. {img:images/NYSEDREGENTS/2011_4th_Grade/04.PNG} Which form of energy is produced when a bell rings?,4,,Train
D,NYSEDREGENTS_2011_4_14,sound,mechanical,light,heat,The diagram below shows a pan of boiling water on a stove. {img:images/NYSEDREGENTS/2011_4th_Grade/05.PNG} Which form of energy changes the water from a liquid to a gas as it boils?,4,,Train
C,NYSEDREGENTS_2011_4_17,{img:images/NYSEDREGENTS/2011_4th_Grade/07.PNG},{img:images/NYSEDREGENTS/2011_4th_Grade/08.PNG},{img:images/NYSEDREGENTS/2011_4th_Grade/09.PNG},{img:images/NYSEDREGENTS/2011_4th_Grade/10.PNG},The diagram below shows a mature flower. {img:images/NYSEDREGENTS/2011_4th_Grade/06.PNG} This flower produced seeds that grew into new flowers. Which new flower is most likely an offspring of this mature flower?,4,,Train
B,NYSEDREGENTS_2011_4_18,a response to the environment,an inherited trait,coloration to attract mates,a seasonal adaptation,The diagram below shows a baby elephant with one of its parents. {img:images/NYSEDREGENTS/2011_4th_Grade/11.PNG} The baby elephant's trunk is an example of,4,,Train
B,NYSEDREGENTS_2011_4_19,A,B,C,D,"Base your answers on the diagram below, which shows four stages in the growth and development of a bean plant. The stages are labeled A, B, C, and D. {img:images/NYSEDREGENTS/2011_4th_Grade/12.PNG} In which stage is germination first visible?",4,,Train
B,NYSEDREGENTS_2011_4_20,seed,leaf,root,stem,"Base your answers on the diagram below, which shows four stages in the growth and development of a bean plant. The stages are labeled A, B, C, and D. {img:images/NYSEDREGENTS/2011_4th_Grade/12.PNG} Which new structure first appears in stage D?",4,,Train
D,NYSEDREGENTS_2011_4_21,larva,egg,adult,pupa,The diagram below shows four stages in the life cycle of a butterfly. One stage is labeled X. {img:images/NYSEDREGENTS/2011_4th_Grade/13.PNG} Which stage is shown at X?,4,,Train
B,NYSEDREGENTS_2011_4_28,life span,food chain,water cycle,seed germinating,"Base your answers on the diagram below and on your knowledge of science. The diagram shows a relationship between several organisms, labeled A, B, C, and D. {img:images/NYSEDREGENTS/2011_4th_Grade/14.PNG} The sequence shown in this diagram represents a",4,,Train
A,NYSEDREGENTS_2011_4_29,A,B,C,D,"Base your answers on the diagram below and on your knowledge of science. The diagram shows a relationship between several organisms, labeled A, B, C, and D. {img:images/NYSEDREGENTS/2011_4th_Grade/14.PNG} Which organism in the diagram is a producer?",4,,Train
C,NYSEDREGENTS_2011_4_30,A,B,C,D,"Base your answers on the diagram below and on your knowledge of science. The diagram shows a relationship between several organisms, labeled A, B, C, and D. {img:images/NYSEDREGENTS/2011_4th_Grade/14.PNG} Which organism in the diagram is both predator and prey?",4,,Train
B,NYSEDREGENTS_2011_4_4,the Sun,the Moon,the stars,Earth,A calendar for the month of September 2003 is shown below. {img:images/NYSEDREGENTS/2011_4th_Grade/02.PNG} The calendar shows the changing appearance of,4,,Train
A,NYSEDREGENTS_2011_4_9,mass,shape,temperature,texture,The diagram below shows a solid piece of chocolate before it was melted and the same piece of chocolate after it was melted into a liquid. {img:images/NYSEDREGENTS/2011_4th_Grade/03.PNG} Which property of the piece of chocolate is the same in the two diagrams?,4,,Train
C,NYSEDREGENTS_2016_4_15,moving 200 g from side A to side B,moving 200 g from side B to side A,moving 100 g from side A to side B,moving 100 g from side B to side A,The diagram below shows a balance. Side A has five blocks and side B has three blocks. The mass of each block is shown in grams (g). {img:images/NYSEDREGENTS/2016_4th_Grade/6.png} A student could balance sides A and B by,4,,Train
B,NYSEDREGENTS_2016_4_17,chemical,electrical,heat,light,The diagram below shows a fan that uses energy to move the air in a room. {img:images/NYSEDREGENTS/2016_4th_Grade/7.png} Which form of energy causes the blades of the fan to turn?,4,,Train
D,NYSEDREGENTS_2016_4_22,solar,sound,electrical,mechanical,The diagram below shows a person lighting a match by rubbing it on a rough surface. {img:images/NYSEDREGENTS/2016_4th_Grade/8.png} Which form of energy is being used to light the match?,4,,Train
A,NYSEDREGENTS_2016_4_23,condensation,evaporation,precipitation,runoff,The diagram below shows a glass of liquid with ice that has been placed in a sunny window. Water droplets have formed on the outside of the glass. {img:images/NYSEDREGENTS/2016_4th_Grade/9.png} Which process caused the water droplets to form on the outside of the glass?,4,,Train
B,NYSEDREGENTS_2016_4_27,less mass,less friction,more gravity,more erosion,"The diagrams A and B below show a student moving the same boxes in two different ways. In diagram B, the student is using wheels, which are part of a simple machine. {img:images/NYSEDREGENTS/2016_4th_Grade/10.png} It will be easier for the student to use wheels to push the boxes in diagram B because there is",4,,Train
B,NYSEDREGENTS_2016_4_28,2F,4F,6F,8F,"The data table below shows air temperatures, in degrees Fahrenheit (F), recorded at noon for five days. {img:images/NYSEDREGENTS/2016_4th_Grade/11.png} How much lower was the temperature at noon on Wednesday than at noon on Monday?",4,,Train
C,NYSEDREGENTS_2016_4_30,28F,40F,50F,65F,The map below shows some weather conditions at five different locations on a single day in the United States. {img:images/NYSEDREGENTS/2016_4th_Grade/12.png} What is the temperature at the location on the map where liquid precipitation is occurring?,4,,Train
D,NYSEDREGENTS_2016_4_4,flower,leaf,stem,roots,The diagram below shows four plant structures. {img:images/NYSEDREGENTS/2016_4th_Grade/1.png} Which plant structure takes in the water and nutrients used by the plant to grow?,4,,Train
B,NYSEDREGENTS_2016_4_5,exercising regularly,eating a balanced diet,avoiding harmful substances,washing hands,The diagram below shows a model used to help people make healthful food choices. {img:images/NYSEDREGENTS/2016_4th_Grade/2.png} Which good health habit is encouraged by this model?,4,,Train
C,NYSEDREGENTS_2016_4_6,obtain water,produce food,disperse (spread),capture sunlight,The diagram below shows seeds from two different plants. {img:images/NYSEDREGENTS/2016_4th_Grade/3.png} Each seed is attached to a structure that helps the seed to,4,,Train
